{
  "$schema": "http://json-schema.org/draft-07/schema#",
  "$id": "https://harness-forge.dev/schemas/report.schema.json",
  "title": "Harness Validator Report",
  "description": "harness-validator の出力 (machine-readable 部分)",
  "type": "object",
  "required": ["schema_version", "target", "generated_at", "summary", "issues"],
  "properties": {
    "schema_version": {
      "type": "string",
      "const": "1.0"
    },
    "target": {
      "type": "string",
      "description": "検証対象プロジェクトの絶対パス"
    },
    "generated_at": {
      "type": "string",
      "format": "date-time"
    },
    "profile": {
      "type": "object",
      "description": "検証時点の profile.json (echoed for traceability)",
      "properties": {
        "archetype_primary": { "type": "string" },
        "schema_version": { "type": "string" }
      }
    },
    "validator_version": {
      "type": "string",
      "description": "harness-validator のバージョン (semver)"
    },
    "summary": {
      "type": "object",
      "required": ["errors", "warnings", "info"],
      "properties": {
        "errors": { "type": "integer", "minimum": 0 },
        "warnings": { "type": "integer", "minimum": 0 },
        "info": { "type": "integer", "minimum": 0 }
      }
    },
    "issues": {
      "type": "array",
      "items": {
        "type": "object",
        "required": ["id", "severity", "message"],
        "properties": {
          "id": {
            "type": "string",
            "pattern": "^C[0-9]{2}$",
            "description": "チェック ID (C01-C99)。references/check-catalog.md で定義"
          },
          "severity": {
            "type": "string",
            "enum": ["ERROR", "WARNING", "INFO"]
          },
          "message": {
            "type": "string",
            "description": "人間向けの1行メッセージ"
          },
          "file": {
            "type": "string",
            "description": "対象ファイルの相対パス"
          },
          "line_start": { "type": "integer", "minimum": 1 },
          "line_end": { "type": "integer", "minimum": 1 },
          "why": {
            "type": "string",
            "description": "なぜこのチェックが存在するかの背景 (Anthropic 公式 / コミュニティ出典)"
          },
          "fix_hint": {
            "type": "string",
            "description": "具体的な修正手順 (コード例含む)"
          },
          "doc_ref": {
            "type": "string",
            "format": "uri",
            "description": "参照ドキュメント URL"
          }
        }
      }
    }
  }
}
