{
  "schema_version": "1.0",
  "target": "/home/sophy/projectx/skill_manual/tests/sandbox-rel",
  "generated_at": "2026-04-24T16:06:05Z",
  "validator_version": "0.1.0",
  "summary": {
    "errors": 0,
    "warnings": 0,
    "info": 0
  },
  "issues": [],
  "profile": {
    "archetype_primary": "daily-utility",
    "schema_version": "1.0"
  }
}
